<?xml version="1.0" encoding="UTF-8"?>
<!--
/**
 * Copyright (c) 2026. Volodymyr Hryvinskyi. All rights reserved.
 * Author: Volodymyr Hryvinskyi <volodymyr@hryvinskyi.com>
 * GitHub: https://github.com/hryvinskyi
 */
-->
<!--
    The hand-written part of the variable knowledge base. Any module may ship a file of this name;
    they are merged, and an entry here always beats one derived from what Magento happens to know.

    The four entries in the first block are worked examples of the four things an administrator can
    be offered - a deep link, an editor in the inspector itself, written steps, and the honest
    answer that nothing can be done. They are real entries and not placeholders, so leave them where
    they are and add new ones to the blocks below rather than replacing these.
-->
<variables xmlns:xsi="http://www.w3.org/2001/XMLSchema-instance"
           xsi:noNamespaceSchemaLocation="urn:magento:module:Hryvinskyi_EmailTemplateEditor:etc/email_variables.xsd">

    <variable kind="config" expression="trans_email/ident_general/name" outputKind="text">
        <title>General Contact sender name</title>
        <summary>The name messages sent from the General Contact identity appear to come from.</summary>
        <origin kind="config" locator="trans_email/ident_general/name">
            Stored in the configuration under Stores &gt; Configuration &gt; General &gt; Store Email
            Addresses &gt; General Contact. Magento\Email\Model\Template\Filter::configDirective reads
            it through the scope configuration for the store view the message is sent in.
        </origin>
        <affordance kind="link" label="Open Store Email Addresses" route="adminhtml/system_config/edit"
                    scopeAware="true">
            <param name="section">trans_email</param>
            <fragment>trans_email_ident_general-link</fragment>
        </affordance>
        <caveat id="scope">
            The value can differ per store view, so check the scope switcher on the configuration page
            before deciding the value is wrong.
        </caveat>
    </variable>

    <variable kind="config" expression="trans_email/ident_general/email" outputKind="text">
        <title>General Contact sender address</title>
        <summary>The email address messages sent from the General Contact identity are sent from.</summary>
        <origin kind="config" locator="trans_email/ident_general/email">
            Stored in the configuration under Stores &gt; Configuration &gt; General &gt; Store Email
            Addresses &gt; General Contact. Magento\Email\Model\Template\Filter::configDirective reads
            it through the scope configuration for the store view the message is sent in.
        </origin>
        <affordance kind="inline" label="Sender email address" editorType="text"
                    route="adminhtml/system_config/edit" scopeAware="true">
            <param name="section">trans_email</param>
            <fragment>trans_email_ident_general-link</fragment>
        </affordance>
        <caveat id="validation">
            The address is checked when it is saved by
            Magento\Config\Model\Config\Backend\Email\Address, so a value that is not an email address
            is refused rather than stored.
        </caveat>
        <caveat id="scope">
            The value can differ per store view. The scope named beside the editor is the one that
            will be written.
        </caveat>
    </variable>

    <variable kind="css" expression="css/email.css" outputKind="text">
        <title>Email stylesheet</title>
        <summary>The stylesheet the message carries in its head, taken from the current theme.</summary>
        <origin kind="computed" locator="Magento\Email\Model\Template\Filter::cssDirective">
            The directive loads the named stylesheet from the theme the message is rendered with,
            compiles it, and puts the result where the directive stands. In the default theme the
            source of this file is web/css/email.less.
        </origin>
        <affordance kind="instruction" label="How to change this">
            <step id="copy">
                Copy the stylesheet into your own theme, under web/css/ in the theme directory.
            </step>
            <step id="edit">
                Edit the copy. A file in the theme takes precedence over the one the theme inherits.
            </step>
            <step id="deploy">
                Deploy static content so the change reaches the next message that is sent.
            </step>
        </affordance>
        <caveat id="plain-text">
            In a plain-text template the directive produces nothing at all.
        </caveat>
        <caveat id="failure">
            When the file cannot be loaded, or compiles to nothing, the directive leaves a CSS comment
            in the message rather than reporting an error.
        </caveat>
    </variable>

    <variable kind="var" expression="store.getId()" outputKind="number">
        <title>Store view id, written as a method call</title>
        <summary>
            This does not print the store view id. On a standard installation it prints nothing at all.
        </summary>
        <origin kind="computed" locator="Magento\Framework\Filter\VariableResolver\StrictResolver::resolve">
            A path inside {{var}} is never a method call. getId() is read as a request for an id value
            held on the store object, and the store record carries store_id rather than id, so the path
            comes back empty.
        </origin>
        <affordance kind="instruction" label="What to write instead">
            <step id="use-the-property">
                Write {{var store.store_id}}, which reads the value the store record actually carries.
            </step>
        </affordance>
        <caveat id="fails-silently">
            Nothing reports this. The directive is replaced by an empty string.
        </caveat>
    </variable>

    <variable kind="var" expression="store.store_id" outputKind="number">
        <title>Store view id</title>
        <summary>The numeric identifier of the store view the message is being sent for.</summary>
        <origin kind="template_var" locator="store_id">
            Magento\Email\Model\AbstractTemplate puts the store view the message is being sent for into
            the template variables under the name store, and store_id is a column of the store record
            it carries.
        </origin>
        <affordance kind="instruction" label="Where this value comes from">
            <step id="fixed-at-creation">
                A store view keeps the id it was given when it was created. Nothing in the
                administration changes it.
            </step>
            <step id="where-to-see-it">
                The store views on this installation are listed under Stores, All Stores.
            </step>
        </affordance>
        <caveat id="not-a-label">
            The id is a database key rather than anything an administrator chose, so it means nothing
            to a recipient.
        </caveat>
    </variable>

    <!--
        Entries describing the directive kinds themselves, the configuration paths a message may read,
        and the store and custom variables, belong below this line.
    -->

    <variable kind="var" expression="" outputKind="text">
        <title>The {{var}} directive</title>
        <summary>
            Prints a value the code that sends the message put into the template, such as a field of
            the order, of the customer or of the store view.
        </summary>
        <origin kind="directive" locator="Magento\Email\Model\Template\Filter::varDirective">
            The name inside the directive is a path into the values the sending code assigned to the
            template: the first part names one of those values and each part after a full stop reads
            something out of it.
        </origin>
        <affordance kind="instruction" label="How to change what this prints">
            <step id="choose">
                To print something else, pick another variable from the variable chooser. That list is
                what the code sending this particular message makes available; a name that is not on it
                prints nothing.
            </step>
            <step id="format">
                To change how it is printed, use the formatting controls in this panel rather than
                typing after the vertical bar, so that only the formatting is rewritten.
            </step>
            <step id="value">
                To change the value itself, change the record it is read from - the order, the
                customer, the store configuration. Nothing in the template writes it.
            </step>
        </affordance>
        <caveat id="escaped-by-default">
            In an email template a {{var}} directive with no vertical bar in it is escaped as HTML.
            That comes from the email template filter rather than from the directive: text run through
            Magento\Framework\Filter\Template on its own - the store address layout, for one - gets no
            escaping at all, so the rule cannot be carried over to templates outside email.
        </caveat>
        <caveat id="unknown-names-are-ignored">
            Only escape and nl2br are implemented. Everything after the first vertical bar is read as
            the formatting, and a name that is neither of those two is skipped without a word. That is
            the whole of how |raw works, and it is also why a misspelling such as |rwa switches the
            escaping off just as effectively.
        </caveat>
        <caveat id="argument-spelling">
            The argument of escape is matched exactly, and the three it accepts are html, htmlentities
            and url. |escape:HTML matches none of them and the value comes back unescaped, so it does